{
  "event_id": "019957a0-000a-7000-8000-00000000010a",
  "event_type": "track.changed",
  "schema_version": "1.0",
  "producer": "track-worker",
  "occurred_at": "2026-09-15T10:00:00Z",
  "published_at": "2026-09-15T10:00:01.250Z",
  "correlation_id": "019957a0-0000-7000-8000-000000000001",
  "causation_id": "019957a0-0008-7000-8000-000000000108",
  "traceparent": "00-4bf92f3577b34da6a3ce929d0e0e4736-00f067aa0ba9020a-01",
  "processing_run_id": "019957a0-0000-7000-8000-00000000a001",
  "pipeline_version": "2026.09.15+6822541",
  "topology_version": 1,
  "lane": "live",
  "aggregate_id": "track:5501",
  "aggregate_revision": 3,
  "source_id": 3,
  "source_message_key": "48213",
  "source_revision": "0",
  "partition_key": "uav",
  "payload": {
    "track_id": 5501,
    "change": "updated",
    "revision": 3,
    "category": "UAV",
    "status": "active",
    "effective_at": "2026-09-15T09:59:40Z",
    "recorded_at": "2026-09-15T10:00:02Z",
    "observation_ids": [
      "019957a0-0100-7000-8000-000000000201"
    ],
    "reason": "new observation linked"
  }
}
