{
  "event_id": "019957a0-0009-7000-8000-000000000151",
  "event_type": "message.analysis.completed",
  "schema_version": "1.0",
  "producer": "finalizer",
  "occurred_at": "2026-09-15T10:00:00Z",
  "published_at": "2026-09-15T10:00:01.250Z",
  "correlation_id": "019957a0-0000-7000-8000-000000000001",
  "causation_id": "019957a0-0004-7000-8000-000000000104",
  "traceparent": "00-4bf92f3577b34da6a3ce929d0e0e4736-00f067aa0ba90209-01",
  "processing_run_id": "019957a0-0000-7000-8000-00000000a002",
  "pipeline_version": "2026.09.15+6822541",
  "topology_version": 1,
  "lane": "replay",
  "source_id": 3,
  "source_message_key": "48213",
  "source_revision": "0",
  "raw_message_id": 4711,
  "payload": {
    "raw_message_id": 4711,
    "extraction_result_id": "019957a0-0200-7000-8000-000000000302",
    "outcome": "completed",
    "method": "rules",
    "fact_count": 2,
    "expected_branches": [
      "track-worker",
      "incident-worker"
    ],
    "versions": {
      "normalization": "norm-3",
      "rules": "13",
      "ruleset_id": "default"
    },
    "timings": {
      "received_at": "2026-09-15T10:00:00Z",
      "stored_at": "2026-09-15T10:00:01Z",
      "normalized_at": "2026-09-15T10:00:01.400Z",
      "parsed_at": "2026-09-15T10:00:01.600Z",
      "finalized_at": "2026-09-15T10:00:01.900Z"
    }
  }
}
