{
  "event_id": "019957a0-0008-7000-8000-000000000118",
  "event_type": "observations.recorded",
  "schema_version": "1.0",
  "producer": "finalizer",
  "occurred_at": "2026-09-15T09:58:00Z",
  "published_at": "2026-09-15T09:58:02Z",
  "correlation_id": "019957a0-0000-7000-8000-000000000021",
  "causation_id": "019957a0-0004-7000-8000-000000000124",
  "traceparent": "00-4bf92f3577b34da6a3ce929d0e0e4737-00f067aa0ba90208-01",
  "processing_run_id": "019957a0-0000-7000-8000-00000000a001",
  "pipeline_version": "2026.09.15+6822541",
  "topology_version": 1,
  "lane": "live",
  "source_id": 1,
  "source_message_key": "31:start",
  "source_revision": "0",
  "partition_key": "place:12",
  "raw_message_id": 4720,
  "payload": {
    "raw_message_id": 4720,
    "extraction_result_id": "019957a0-0200-7000-8000-000000000311",
    "extraction_version": 1,
    "method": "structured",
    "versions": {
      "normalization": "norm-3",
      "catalog_policy": "kinds-1"
    },
    "observations": [
      {
        "observation_id": "019957a0-0100-7000-8000-000000000211",
        "event_kind_code": "alert.air_raid.started",
        "category": "alert",
        "effective_at": "2026-09-15T09:58:00Z",
        "location": {
          "kind": "region",
          "place_id": 12
        },
        "confidence": "confirmed",
        "evidence": {
          "structured_field": "alert.started_at"
        },
        "attributes": {
          "external_alert_id": "alerts_in_ua:31",
          "alert_type": "air_raid"
        }
      }
    ],
    "expected_branches": [
      "alert-worker"
    ]
  }
}
