{
  "event_id": "019957a0-000e-7000-8000-00000000010e",
  "event_type": "alert.expiry.requested",
  "schema_version": "1.0",
  "producer": "watchdog",
  "occurred_at": "2026-09-15T13:58:05Z",
  "published_at": "2026-09-15T13:58:05.100Z",
  "correlation_id": "019957a0-0000-7000-8000-000000000021",
  "causation_id": "019957a0-000b-7000-8000-00000000010b",
  "traceparent": "00-4bf92f3577b34da6a3ce929d0e0e4737-00f067aa0ba9020e-01",
  "processing_run_id": "019957a0-0000-7000-8000-00000000a001",
  "pipeline_version": "2026.09.15+6822541",
  "topology_version": 1,
  "lane": "live",
  "aggregate_id": "alert:7001",
  "aggregate_revision": 1,
  "source_id": 1,
  "source_message_key": "31:start",
  "source_revision": "0",
  "payload": {
    "alert_id": 7001,
    "expected_revision": 1,
    "expire_at": "2026-09-15T13:58:00Z",
    "watermark": "2026-09-15T13:58:05Z",
    "reason": "text alert max age reached"
  }
}
