{
  "event_id": "019957a0-0006-7000-8000-000000000106",
  "event_type": "llm.completed",
  "schema_version": "1.0",
  "producer": "llm-worker",
  "occurred_at": "2026-09-15T10:00:00Z",
  "published_at": "2026-09-15T10:00:01.250Z",
  "correlation_id": "019957a0-0000-7000-8000-000000000001",
  "causation_id": "019957a0-0005-7000-8000-000000000105",
  "traceparent": "00-4bf92f3577b34da6a3ce929d0e0e4736-00f067aa0ba90206-01",
  "processing_run_id": "019957a0-0000-7000-8000-00000000a001",
  "pipeline_version": "2026.09.15+6822541",
  "topology_version": 1,
  "lane": "live",
  "source_id": 3,
  "source_message_key": "48213",
  "source_revision": "0",
  "raw_message_id": 4711,
  "payload": {
    "raw_message_id": 4711,
    "request_id": "019957a0-0300-7000-8000-000000000401",
    "provider_request_id": "msg_01XYZ",
    "fencing_token": 1,
    "model": "claude-sonnet-5",
    "prompt_version": "extract-v7",
    "outcome": "facts",
    "facts": [
      {
        "event_kind_code": "target.observed",
        "category": "target",
        "effective_at": "2026-09-15T09:59:40Z",
        "location": {
          "kind": "city",
          "place_id": 1201,
          "accuracy_km": 5
        },
        "confidence": "medium",
        "evidence": {
          "model": "claude-sonnet-5",
          "prompt_version": "extract-v7"
        },
        "attributes": {
          "category": "uav",
          "direction": {
            "kind": "towards_place",
            "place_id": 1201
          }
        }
      }
    ],
    "usage": {
      "input_tokens": 812,
      "output_tokens": 96,
      "cost_usd": 0.0041
    },
    "duration_ms": 2380
  }
}
