{
  "event_id": "019957a0-000b-7000-8000-00000000010b",
  "event_type": "alert.changed",
  "schema_version": "1.0",
  "producer": "alert-worker",
  "occurred_at": "2026-09-15T09:58:00Z",
  "published_at": "2026-09-15T09:58:02.500Z",
  "correlation_id": "019957a0-0000-7000-8000-000000000021",
  "causation_id": "019957a0-0008-7000-8000-000000000118",
  "traceparent": "00-4bf92f3577b34da6a3ce929d0e0e4737-00f067aa0ba9020b-01",
  "processing_run_id": "019957a0-0000-7000-8000-00000000a001",
  "pipeline_version": "2026.09.15+6822541",
  "topology_version": 1,
  "lane": "live",
  "aggregate_id": "alert:7001",
  "aggregate_revision": 1,
  "source_id": 1,
  "source_message_key": "31:start",
  "source_revision": "0",
  "partition_key": "place:12",
  "payload": {
    "alert_id": 7001,
    "change": "started",
    "revision": 1,
    "scope": {
      "place_id": 12,
      "external_alert_id": "alerts_in_ua:31",
      "level": "unknown"
    },
    "started_at": "2026-09-15T09:58:00Z",
    "effective_at": "2026-09-15T09:58:00Z",
    "recorded_at": "2026-09-15T09:58:02.400Z",
    "observation_ids": [
      "019957a0-0100-7000-8000-000000000211"
    ]
  }
}
