{
  "event_id": "019957a0-0004-7000-8000-000000000104",
  "event_type": "parse.completed",
  "schema_version": "1.0",
  "producer": "parser",
  "occurred_at": "2026-09-15T10:00:00Z",
  "published_at": "2026-09-15T10:00:01.250Z",
  "correlation_id": "019957a0-0000-7000-8000-000000000001",
  "causation_id": "019957a0-0003-7000-8000-000000000103",
  "traceparent": "00-4bf92f3577b34da6a3ce929d0e0e4736-00f067aa0ba90204-01",
  "processing_run_id": "019957a0-0000-7000-8000-00000000a001",
  "pipeline_version": "2026.09.15+6822541",
  "topology_version": 1,
  "lane": "live",
  "source_id": 3,
  "source_message_key": "48213",
  "source_revision": "0",
  "raw_message_id": 4711,
  "payload": {
    "raw_message_id": 4711,
    "attempt_id": "019957a0-0400-7000-8000-000000000501",
    "outcome": "facts",
    "method": "rules",
    "versions": {
      "normalization": "norm-3",
      "rules": "12",
      "ruleset_id": "default"
    },
    "facts": [
      {
        "event_kind_code": "target.observed",
        "category": "target",
        "effective_at": "2026-09-15T09:59:40Z",
        "location": {
          "kind": "city",
          "place_id": 1201,
          "accuracy_km": 5
        },
        "confidence": "medium",
        "evidence": {
          "span": {
            "start": 0,
            "end": 33
          },
          "rule_id": "shahed-course-city",
          "rule_version": "12"
        },
        "attributes": {
          "category": "uav",
          "direction": {
            "kind": "towards_place",
            "place_id": 1201
          }
        }
      }
    ],
    "duration_ms": 14
  }
}
