{
  "event_id": "019957a0-000d-7000-8000-00000000010d",
  "event_type": "track.expiry.requested",
  "schema_version": "1.0",
  "producer": "watchdog",
  "occurred_at": "2026-09-15T10:30:05Z",
  "published_at": "2026-09-15T10:30:05.100Z",
  "correlation_id": "019957a0-0000-7000-8000-000000000001",
  "causation_id": "019957a0-000a-7000-8000-00000000010a",
  "traceparent": "00-4bf92f3577b34da6a3ce929d0e0e4736-00f067aa0ba9020d-01",
  "processing_run_id": "019957a0-0000-7000-8000-00000000a001",
  "pipeline_version": "2026.09.15+6822541",
  "topology_version": 1,
  "lane": "live",
  "aggregate_id": "track:5501",
  "aggregate_revision": 3,
  "source_id": 3,
  "source_message_key": "48213",
  "source_revision": "0",
  "payload": {
    "track_id": 5501,
    "expected_revision": 3,
    "expire_at": "2026-09-15T10:30:00Z",
    "watermark": "2026-09-15T10:30:05Z",
    "reason": "no observations for 30 min"
  }
}
