{
  "event_id": "019957a0-0005-7000-8000-000000000105",
  "event_type": "llm.requested",
  "schema_version": "1.0",
  "producer": "parser",
  "occurred_at": "2026-09-15T10:00:00Z",
  "published_at": "2026-09-15T10:00:01.250Z",
  "correlation_id": "019957a0-0000-7000-8000-000000000001",
  "causation_id": "019957a0-0003-7000-8000-000000000103",
  "traceparent": "00-4bf92f3577b34da6a3ce929d0e0e4736-00f067aa0ba90205-01",
  "processing_run_id": "019957a0-0000-7000-8000-00000000a001",
  "pipeline_version": "2026.09.15+6822541",
  "topology_version": 1,
  "lane": "live",
  "source_id": 3,
  "source_message_key": "48213",
  "source_revision": "0",
  "raw_message_id": 4711,
  "payload": {
    "raw_message_id": 4711,
    "request_id": "019957a0-0300-7000-8000-000000000401",
    "model": "claude-sonnet-5",
    "prompt_version": "extract-v7",
    "fencing_token": 1,
    "deadline_at": "2026-09-15T10:02:00Z",
    "budget": {
      "max_output_tokens": 1024,
      "max_cost_usd": 0.02
    },
    "input": {
      "normalized_text_hash": "9f86d081884c7d659a2feaa0c55ad015a3bf4f1b2b0b822cd15d6c15b0f00a08",
      "normalization_version": "norm-3"
    },
    "rules_context": {
      "outcome": "needs_llm",
      "reason": "ambiguous target class"
    }
  }
}
